{
  "schema_version": "0.1",
  "task_id": "casting_c1_fixed_seed_0",
  "route": "lava_casting",
  "difficulty": 1,
  "agent_ids": ["agent_1"],
  "world_seed": 0,
  "instruction": "Use the provided water, lava, bucket, and support blocks to make the target cell become obsidian. Stop after the target cell is confirmed or the action budget is exhausted.",
  "spawn_positions": {
    "agent_1": [0, 4, 0]
  },
  "initial_inventories": {
    "agent_1": {
      "water_bucket": 1,
      "lava_bucket": 1,
      "cobblestone": 8
    }
  },
  "workflow": "casting_c1_fixed",
  "milestones": [
    "task_reset",
    "liquid_resources_ready",
    "casting_site_selected",
    "lava_placed",
    "water_used",
    "first_obsidian_cast"
  ],
  "limits": {
    "max_environment_steps": 160,
    "max_model_calls": 1,
    "max_game_time_seconds": 120
  },
  "split": "development",
  "scenario_parameters": {
    "implementation_status": "contract_only",
    "world_dimension": "minecraft:overworld",
    "layout": "fixed_controlled",
    "target_cell": [2, 4, 3],
    "target_initial_block": "air",
    "resource_layout": "fixed",
    "mechanics_required": "vanilla_water_lava_block_update",
    "allow_minecraft_commands": false,
    "allow_evaluator_world_mutation": false,
    "allow_live_run": false,
    "requires_explicit_live_run_approval": true
  }
}
