{
  "schema_version": "0.1",
  "task_id": "route_a_a0_development_seed_0",
  "route": "obsidian_mining",
  "difficulty": 1,
  "agent_ids": [
    "agent_1"
  ],
  "world_seed": 0,
  "instruction": "Use the provided materials to build and activate a Nether portal, then enter the Nether.",
  "spawn_positions": {
    "agent_1": [
      0,
      4,
      0
    ]
  },
  "initial_inventories": {
    "agent_1": {
      "obsidian": 14,
      "flint_and_steel": 1,
      "dirt": 2
    }
  },
  "workflow": "route_a_a0",
  "milestones": [
    "task_reset",
    "critical_resources_checked",
    "build_site_selected",
    "first_obsidian_placed",
    "valid_portal_frame",
    "portal_activated",
    "agent_entered_nether"
  ],
  "limits": {
    "max_environment_steps": 500,
    "max_model_calls": 40,
    "max_game_time_seconds": 600
  },
  "split": "development"
}
