{
  "schema_version": "0.1",
  "task_id": "casting_c3_fixed_seed_0",
  "route": "lava_casting",
  "difficulty": 2,
  "agent_ids": ["agent_1"],
  "world_seed": 0,
  "instruction": "Use the provided water, lava, and support blocks to make all three target cells become obsidian in the fixed order. Stop after all three cells are confirmed or the action budget is exhausted.",
  "spawn_positions": {
    "agent_1": [0, 4, 0]
  },
  "initial_inventories": {
    "agent_1": {
      "water_bucket": 3,
      "lava_bucket": 3,
      "cobblestone": 6
    }
  },
  "workflow": "casting_c3_fixed",
  "milestones": [
    "task_reset",
    "cell_0_obsidian_cast",
    "cell_1_obsidian_cast",
    "cell_2_obsidian_cast"
  ],
  "limits": {
    "max_environment_steps": 240,
    "max_model_calls": 1,
    "max_game_time_seconds": 180
  },
  "split": "development",
  "scenario_parameters": {
    "task_family": "casting",
    "agent_mode": "single",
    "task_level": "C2",
    "layout_type": "fixed",
    "compatibility_task_name": "casting_s_c2_fixed",
    "implementation_status": "offline_fake_verified",
    "world_dimension": "minecraft:overworld",
    "layout": "fixed_controlled",
    "target_cells": [
      [2, 4, 3],
      [3, 4, 3],
      [4, 4, 3]
    ],
    "target_initial_blocks": ["air", "air", "air"],
    "resource_layout": "fixed",
    "mechanics_required": "vanilla_water_lava_block_update",
    "allow_minecraft_commands": false,
    "allow_evaluator_world_mutation": false,
    "allow_live_run": false,
    "requires_explicit_live_run_approval": true,
    "causality_window_steps": 4,
    "recoveries_per_action": 1,
    "total_recovery_budget": 3
  }
}
